<?xml version="1.0" encoding="UTF-8"?>
<vouchers xmlns:xsi="http://www.w3.org/2001/XMLSchema-instance"
          xmlns="http://www.training.by/vouchers"
          xsi:schemaLocation="http://www.training.by/vouchers vouchers.xsd">
    <voucher id="first">
        <type>weekend</type>
        <country>Egypt</country>
        <numberDaysNights>10</numberDaysNights>
        <transport>plane</transport>
        <hotel-characteristics>
            <stars>5</stars>
            <nutrition>AL</nutrition>
            <room>2</room>
            <TV>true</TV>
            <WI-FI>true</WI-FI>
            <air-conditioning>true</air-conditioning>
        </hotel-characteristics>
        <cost currency="USD">1000</cost>
        <data-start>18.04.2019</data-start>
        <data-finish>28.04.2019</data-finish>
    </voucher>
</vouchers>
        <!--<element name="weekend" type="string"/>-->
        <!--<element name="relaxation" type="string"/>-->
        <!--<element name="excursion" type="string"/>-->
        <!--<element name="pilgrimage" type="string"/>-->